{
  "canonical_json": {
    "digest": "sha-256-lowercase-hex",
    "format": "RFC-8785-JCS",
    "integer_maximum": 9007199254740991,
    "integer_minimum": -9007199254740991,
    "jcs_key_order": "unsigned-utf16-code-units",
    "normalization": "none",
    "raw_input_requirements": [
      "utf8-without-bom",
      "no-duplicate-members",
      "unicode-scalars-only",
      "finite-binary64-numbers"
    ],
    "validator_order": "unsigned-utf8-bytes"
  },
  "compatibility": {
    "contract_profile_binding": "explicit-major",
    "minor_upgrade": "explicit-lock-change",
    "old_major_minimum_release_cycles": 1,
    "old_major_mode": "read-only"
  },
  "conformance": {
    "comparison": "exact-normative-projection",
    "consumer_count": 2,
    "expected_result_required": true,
    "primary_consumer_priority_on_mismatch": false
  },
  "diagnostics": {
    "catalog": "diagnostics/conformance.json",
    "maximum_per_phase": 100,
    "sort_order": [
      "path-utf8",
      "severity",
      "code-utf8",
      "details-jcs"
    ]
  },
  "implementation_roles": {
    "normative_implementation": "none",
    "primary": "typescript",
    "secondary": "python-independent",
    "shared_validator": "forbidden"
  },
  "normative_artifacts": {
    "categories": [
      "profile",
      "schemas",
      "diagnostics",
      "fixtures",
      "lock"
    ],
    "priority": [
      "accepted-adr",
      "machine-artifacts",
      "conforming-implementations",
      "documentation"
    ]
  },
  "portable_limits": {
    "bundle_resources": 128,
    "cognitive_node_jcs_bytes": 1048576,
    "diagnostics_per_phase": 100,
    "json_depth": 64,
    "json_members_and_elements": 100000,
    "ref_chain": 64,
    "regex_unicode_scalars": 1024,
    "schema_admission_work_units": 250000,
    "semantic_validation_work_units": 1000000,
    "single_array_items": 10000,
    "single_string_utf8_bytes": 262144,
    "type_definition_bundle_jcs_bytes": 2097152
  },
  "profile_id": "org.intelliengine.conformance",
  "profile_version": "1.0.0",
  "publication": {
    "compatibility": "major-explicit-minor-opt-in",
    "mode": "shadow-until-two-consumers-conform",
    "old_major_read_only_minimum_release_cycles": 1
  },
  "references": {
    "cross_resource": "digest-uri-dag-only",
    "digest_uri_prefix": "urn:intelliengine:schema:sha256:",
    "external_fallback": "forbidden",
    "local_fragment_recursion": "instance-location-must-descend",
    "non_productive_local_cycle": "reject-at-admission"
  },
  "regex_profile": {
    "ast_nodes": [
      "literal",
      "dot",
      "anchor",
      "class",
      "class-range",
      "concatenation",
      "alternation",
      "group",
      "quantifier"
    ],
    "case_sensitive": true,
    "forbidden": [
      "backreference",
      "lookaround",
      "named-group",
      "atomic-group",
      "conditional-group",
      "inline-flag",
      "lazy-quantifier",
      "possessive-quantifier",
      "implementation-private-escape",
      "unicode-property-escape",
      "quantified-group-containing-quantifier-or-alternation"
    ],
    "matching": "unanchored-search",
    "maximum_repeat": 10000,
    "productions": [
      {
        "alternatives": [
          [
            {
              "name": "alternation",
              "repeat": "once"
            }
          ]
        ],
        "name": "pattern"
      },
      {
        "alternatives": [
          [
            {
              "name": "concatenation",
              "repeat": "once"
            },
            {
              "name": "alternation-tail",
              "repeat": "zero-or-more"
            }
          ]
        ],
        "name": "alternation"
      },
      {
        "alternatives": [
          [
            {
              "name": "pipe",
              "repeat": "once"
            },
            {
              "name": "concatenation",
              "repeat": "once"
            }
          ]
        ],
        "name": "alternation-tail"
      },
      {
        "alternatives": [
          [
            {
              "name": "quantified-atom",
              "repeat": "zero-or-more"
            }
          ]
        ],
        "name": "concatenation"
      },
      {
        "alternatives": [
          [
            {
              "name": "atom",
              "repeat": "once"
            },
            {
              "name": "quantifier",
              "repeat": "optional"
            }
          ]
        ],
        "name": "quantified-atom"
      },
      {
        "alternatives": [
          [
            {
              "name": "literal",
              "repeat": "once"
            }
          ],
          [
            {
              "name": "escape",
              "repeat": "once"
            }
          ],
          [
            {
              "name": "dot",
              "repeat": "once"
            }
          ],
          [
            {
              "name": "start-anchor",
              "repeat": "once"
            }
          ],
          [
            {
              "name": "end-anchor",
              "repeat": "once"
            }
          ],
          [
            {
              "name": "character-class",
              "repeat": "once"
            }
          ],
          [
            {
              "name": "group",
              "repeat": "once"
            }
          ]
        ],
        "name": "atom"
      },
      {
        "alternatives": [
          [
            {
              "name": "class-open",
              "repeat": "once"
            },
            {
              "name": "negation",
              "repeat": "optional"
            },
            {
              "name": "class-item",
              "repeat": "zero-or-more"
            },
            {
              "name": "class-close",
              "repeat": "once"
            }
          ]
        ],
        "name": "character-class"
      },
      {
        "alternatives": [
          [
            {
              "name": "literal",
              "repeat": "once"
            }
          ],
          [
            {
              "name": "escape",
              "repeat": "once"
            }
          ],
          [
            {
              "name": "range",
              "repeat": "once"
            }
          ]
        ],
        "name": "class-item"
      },
      {
        "alternatives": [
          [
            {
              "name": "literal",
              "repeat": "once"
            },
            {
              "name": "range-separator",
              "repeat": "once"
            },
            {
              "name": "literal",
              "repeat": "once"
            }
          ]
        ],
        "name": "range"
      },
      {
        "alternatives": [
          [
            {
              "name": "group-open",
              "repeat": "once"
            },
            {
              "name": "alternation",
              "repeat": "once"
            },
            {
              "name": "group-close",
              "repeat": "once"
            }
          ]
        ],
        "name": "group"
      },
      {
        "alternatives": [
          [
            {
              "name": "star",
              "repeat": "once"
            }
          ],
          [
            {
              "name": "plus",
              "repeat": "once"
            }
          ],
          [
            {
              "name": "question",
              "repeat": "once"
            }
          ],
          [
            {
              "name": "bounded-repeat",
              "repeat": "once"
            }
          ]
        ],
        "name": "quantifier"
      }
    ],
    "quantifier_constraints": {
      "greedy_only": true,
      "group_with_alternation_or_quantifier_may_be_quantified": false,
      "maximum": 10000,
      "minimum": 0
    },
    "terminals": [
      {
        "lexeme": null,
        "machine_predicate": {
          "kind": "unicode-scalar-excluding",
          "values": [
            "\\",
            ".",
            "^",
            "$",
            "[",
            "]",
            "(",
            ")",
            "|",
            "*",
            "+",
            "?",
            "{",
            "}"
          ]
        },
        "name": "literal",
        "token_kind": "scalar"
      },
      {
        "lexeme": "\\",
        "machine_predicate": {
          "kind": "escape-literal-catalog",
          "values": [
            ".",
            "*",
            "+",
            "?",
            "[",
            "]",
            "(",
            ")",
            "{",
            "}",
            "|",
            "^",
            "$",
            "\\"
          ]
        },
        "name": "escape",
        "token_kind": "escaped-scalar"
      },
      {
        "lexeme": ".",
        "machine_predicate": null,
        "name": "dot",
        "token_kind": "punctuation"
      },
      {
        "lexeme": "^",
        "machine_predicate": null,
        "name": "start-anchor",
        "token_kind": "punctuation"
      },
      {
        "lexeme": "$",
        "machine_predicate": null,
        "name": "end-anchor",
        "token_kind": "punctuation"
      },
      {
        "lexeme": "[",
        "machine_predicate": null,
        "name": "class-open",
        "token_kind": "punctuation"
      },
      {
        "lexeme": "]",
        "machine_predicate": null,
        "name": "class-close",
        "token_kind": "punctuation"
      },
      {
        "lexeme": "^",
        "machine_predicate": null,
        "name": "negation",
        "token_kind": "punctuation"
      },
      {
        "lexeme": "-",
        "machine_predicate": null,
        "name": "range-separator",
        "token_kind": "punctuation"
      },
      {
        "lexeme": "|",
        "machine_predicate": null,
        "name": "pipe",
        "token_kind": "punctuation"
      },
      {
        "lexeme": "(",